Mots,top_review_1,top_review_2,top_review_3
"come, table, server, waitress, ask, waiter, back, take, check, sit, bring, seat, water, meal, bill",,,
"say, would, tell, call, give, could, manager, make, customer, ask, one, rude, want, know, room",,,
"bar, drink, beer, bartender, night, friend, go, great, sit, one, area, game, crowd, music, pretty",,,
"burger, fry, cheese, bun, well, onion, good, cook, medium, bacon, cold, rare, greasy, ring, beer",,,
"taste, dish, good, sauce, flavor, like, roll, sushi, price, soup, small, menu, salad, much, meat",,,
"get, take, even, right, pay, one, eat, sandwich, star, people, forever, kid, wrong, could, try",,,
"wait, minute, hour, seat, 30, 15, 20, long, min, 10, 45, arrive, line, another, staff",,,
"order, take, delivery, call, wrong, deliver, receive, half, minute, item, tell, food, drink, online, hour",,,
"service, bad, ever, customer, slow, terrible, horrible, experience, rude, poor, even, awful, location, attitude, server",,,
"pizza, crust, cheese, slice, topping, delivery, sauce, cold, pie, thin, good, call, salad, sausage, soggy",,,
"food, good, restaurant, price, quality, mediocre, cold, overprice, great, chinese, not, atmosphere, average, eat, indian",,,
"time, go, last, back, location, first, year, use, visit, every, second, always, waste, long, several",,,
"place, like, really, good, look, want, people, staff, try, seem, coffee, go, feel, love, not",,,
"taco, fish, chip, salsa, mexican, tortilla, burrito, bean, cheese, bland, corn, margarita, breakfast, eat, ever",,,
"chicken, rice, fry, wing, sauce, dry, salad, piece, taste, curry, lunch, eat, cold, meat, fried",,,
,"Horrible service... after 20 minutes at the table we had to ask the hostess where our waiter was.  Then we watched all the employees stand around and try and pass us off on each other.  Eventually the ""unluckiest"" came to our table to get us started.  He brought the four items we ordered to the table separately and brought the beer that one person ordered last.  Waiter came back to give us the check without asking if we wanted anything else.  Another beer was ordered, which seemed to be an imposition since the check was already ready.  At the end, he gave us his name and asked us to come back.  I think not....","Where do I start lol so my boyfriend and I just wanted to come in to get some good food and margaritas. We barely got that. So we got sat outside in the corner no big deal. First our table was dirty and it took about 20-30 minutes for that to get cleaned. Our server never came and after being stared at by a nearby server who finally said ""Oh! Has no one came to you guys yet"" that's when we kinda got some service. She took our drink orders..this isn't our server by the way and eventually our actual server, Margaux finally came to our table with waters. Again still dirty table. Again it took 20 minutes for her to even come to our table. 

I got the peach margarita and it was unbelievably sweet. I like sweet drinks but that was a bit much for me. So she took our food order and we didn't see her again for like 30 minutes. The food was ok nothing to get excited about. But we wanted to get another margarita and just chill but it took her so long to come back to our table, we just didn't want to be there anymore. We had been here before and got similar service soooo yeah, definitely over this place and not coming back. Sucks though because margaritas are pretty cheap.","Like Lauren B. said, this was a horrible decision based on the weather, lack of other places nearby to walk to, and hunger. The hostess forgot about us/forgot to give us a beeper so we lost our first table. The waitress didn't come for about 10 minutes because we had drinks already and thought we were being taken care of. We didn't have knives on the table, but had 2 forks each.

My fries came out cold, they forgot a person's side order, messed up another person's order, and seemed like this was their first day. Scary thing was, though, that our waitress was training someone else who came up to us after the dessert and coffee were served (and still on our table) and she started to give us another table's dinner order.

I am not going back."
,"I called due to a ad on a website provided by Westgate saying that Disney tickets were being sold for $59 called and was told to make a reservation for tour and that could get three Disney Epcot and three universal ... but would need to pay 565.00. ... so we paid rep Caroline ... we started getting calls for the next three days asking to verify income, marital status and card details ... gave same info each time ... 4th day was finally sick of calls and went off on Caroline's supervisor Linda ... she said she didn't get a completed call of verification ... so I again verified my info ... she then stated that there was a question of my marital status because they had traced my phone number and saw where a call was placed back three months earlier saying the Person was married travailing without their spouse and if they could still do the tour for a hotel stay ... I explained that my mother had called about a hotel stay she had seen on her work site at Westgate and that she had a different middle initial then my own but we had the same first name as it was a family name ... she said oh that's okay and confirmed everything and sent us an email confirmation for our tour ... fast forward to being on vacation in Florida at Westgate Lakes tour date ...sign in ad end up sitting there for 39 min while everyone who came in after us headed out for tour ... finally their manager Jessica calls me over and says she can't give us the tour because of descrepency with marriage status ... I'm like what !!!!! I already went over this with Westgate corporate manager Linda and she said it was fine and I was okay to come ...Jessica proceeds to tell me the tour wasnt happening and I wasn't getting my tickets ... I then Say I want my money then and she days yeah u can have ur money in 5-10 business days ... so I really get upset ... when they took the money out it wasn't in five-ten business days and we needed the money to go buy legit tickets ... she was all cold and saying I'm sorry we can't help u ... u can call corporate was all she would say ...so of course I call and they've are closed for another two hours ... I'm really mad now ... we gave up $560 and was lied to my their corporate office with them saying we were clear on verification and got up at the butt crack of dawn to drive an hour to Westgate lakes to be denied our money and our tickets .... so Jessica the manager st the location then tells us we can sit and wait for corporate but she knew the answe would still be no... after waiting two hours and trying to search online for my divorce paperwork ...I call corporate they say they can't refund my money for 5-10 days ... and no tour can be given ...I tell them if the inconvenience we went through after being lied to by their corporate manager Linda ... and they still don't do anything .. I escalate again and get another manager who tells me u can pay the difference of the $560 of $221 and pay for yeh full price of the tickets which by the way cost more then the tickets are at the gate .. and taking the lesser of the two evils we pay the extra because we don't want to get screwed out of money we needed for vacation and paid the fee ...so I tell the lady to stay on the phone until we get the tickets from Jessica ... she tells me on the phone to go to the counter and ask for Jessica ... I go up and say can I speak with Jessica the manager ... and the lady behind the desk says 'yes, please and thank you' and she stands and walks off ... where do these horrible customer service reps get their nerve ... who in their right mind would get a time Share with these idiots ... so I'm still on the phone  and I tell the manger on the phone 'did u hear that, she was completely rude and for what... that wa smh first time speaking to her'... the phone manager asks me to get her name as she's building a file ... so I ask the lady at the counter who had been sitting next to her and .. she says I can't say it's a different department ... and she clams up ... i tell the phone manager they they refused to give names and she goes on to say that she will get details during the investigation and so u finally get Jessica back and ask her the names and she says she can't say because her Custer agents are from a different department .... the phone manager then says she can't really say what's happened as she can only make out a little info as she's having phone sound difficulty ... what a joke !!!!!!.... these reps really know how to lie and cheat they're way out of anything and have the worst customer service and people skills ever !!!... if they are like this on a tour ... imagine having them as a time share location ...... run !!!!!...... they take no accountability for their own actions and basically lie and scheme to take money off the unexpected !...I'm the end I got my tickets and they too were the wrong ones to the wrong park .... lawsuit and bank dispute in their future from me!","I never leave bad reviews but this one is post worthy.

3 days before our teams trip to Orlando I called and spoke to a young lady who took the time (over 10minutes)to accept my reservation of 30 people (15 kids 15 adults) the young lady said she could accommodate us outside and specifically said they had heating lamps in case it was cold. She took my name and phone number and said to call an hour before to confirm. GREAT! 

Fast forward I called 2 hours ahead of time on the day of reservation  to confirm  and spoke with a young lady who said she had no information on us and they don't take reservations. I then asked to speak to her manager. 

Her manager gets on the phone immediately with an attitude as though I'm bothering her. She says whoever we spoke to should never have said she could accommodate us. I explained to the manager that i had 30 people who would be hungry for dinner at 730 after a long day of competition and what was I to do. Her response? Sir I can't help you is there anything else? SERIOUSLY? Yes!

I told her that I will be contacting corporate. 

I've owned restaurants and would never speak to anyone in such a way. I then received a phone call back a half an hour later by the same girl, and I saved the message because I will be contacting corporate, she still sounded annoyed and said due to the incompetence of our staff please call us back to see how we can rectify this situation.

Needless to say I never called back and 30 of us gave our business elsewhere.","We live about 20 minutes away from this restaurant but had been given a $15 gift certificate from Restaurant.com that we wanted to use, it had just been purchased 3 days prior. We decided to give it a shot.  The food was pretty good, comparable to many other mexican restaurants though.  The service was SLOW.  We were in the section by the bar so our server was also playing bartender, bad idea.  As the bar filled up our service became even slower.

When it came time to check out I handed the server our $15 gift certificate.  He immediately shook his head and said ""We no longer accept those.""  I explained that it had just been purchased 3 days prior on October 10, 2016.  After we discussed the validity of the certificate, he said he would get the manager, obviously not the server's issue.  The manager came over and immediately shook his head.  He denied ever doing business with restaurant.com.  Mind you, this goes completely against what the server told us.  The server said that they stopped accepting them which means they did at one time.  The manager denied this and basically told me we were out of luck.  I explained that the sole purpose of even coming here to try this place out was the incentive of the gift certificate.  In fact we had ordered more food then we normally would to satisfy the requirements of the gift certificate, further inflating our bill.  He didn't care.  He said the certificate was no good and told me I needed to contact restaurant.com.  First of all, that is incorrect.I think the restaurant needs to contact them and see why they are selling gift certificates with the restaurant's name.

He was rude, arrogant and dismissive.  It completely ruined out entire dinner.  It's not about a measly $15.00.  Its about being in the service industry and accommodating your customers.  I suggested they put it up in the window to warn other customers who may have the certificate.  He said, ""Yea we did that for a couple weeks but took it down.""  When I asked to have the owner's first name so I could contact them to discuss he refused to give it to me.  HE REFUSED TO GIVE ME THE OWNER'S FIRST NAME. Then I asked his name and he said ""Mike""  LOL, this guy's name was not Mike. The whole thing was so crazy I thought there may be a hidden camera. I looked at a couple that was overhearing the whole thing and they were shaking there heads and laughing at how ridiculous this ""manager"" was.  I told him that I would be reviewing this experience on multiple sites and he said he didn't care.  I said ""Over $15??""  He said ""do whatever you want.""  LMAO  $15 is money well spent so I know to never go here again and let everyone I know to never go here again.

What a joke!!!  Do not go to this restaurant.  There are several other options in the area that are better.  There is nothing more I can't stand then basic customer service.  This isn't about the customer always being right, this is about basic customer service.  Do me a solid and go somewhere else.  I left my name and number and asked to have the owner call me.  I will happily take down these reviews if they offer to make this right."
,"Roscoe's is your middle-of-the-road bar located in Montavilla. It's neither upscale nor a dive bar, just a comfy dark pub to enjoy good beer, bar food and pool. The tap selection is pretty spectacular and the service is spot-on. I also like that when you start a tab at the bar, they swipe your card and then give it back to you to avoid someone throwing back a few too many walking out without their card and leaving the bar with an unfinished tab. 

This should be a solid 4 star review. However, the experience I recently had when 4 friends and I decided to grab a late-night beer on a quiet Sunday night drops this review down to two stars. On this night, there was another regular patron who was straight up frightening. He was obviously loaded, and not a very nice drunk; playing all the metal music available on the jukebox, throwing his pool cue down like a two-year-old having a temper tantrum, and standing on bar stools over the bar while pulling his pants down around his ankles (thank god he wasn't going commando!) 

The main reason we ended up chugging our beers and high-tailing it out of there is that the bartenders did nothing to quiet, cut-off or kick out this unruly dude. We couldn't quite tell if the bartenders were friends with the guy, or afraid of what might happen if they did try to curb his behavior. I can't imagine being a bartender, bouncer, babysitter and OLCC enforcer all at the same time is an easy feat, but someone really should have stepped in and taken control of the situation. Not many people like a side of crazy with their beer.","We went here on a Saturday night when they had an 80s themed DJ.  They were obviously not used to the crowd of people as they had the chef at the bar making drinks too.  For some reason, they had the seating area closed past the bar and it was so crowded I heard several people leave.  The bartender we got was half pouring drinks, they were very weak and he couldn't find a lime for the drink and said they were out although another bartender was cutting one up shortly after.  So, I thought it was overpriced with bad service, but they were definitely overwhelmed that night.","I have been here for drinks several times and never had an issue. 

I was there yesterday afternoon and had a terrible experience. I will not be returning anytime soon. 

The bartender dropped my friends drink on the bar and it completely shattered and spilt all over her. Then, I was drinking my beer and there was a bug swimming around in it. I didn't notice at first because it was such a dark beer. It was absolutely disgusting, and the staff didn't even apologize once I informed them. 

I will not be back. And, if you don't want bugs in your drinks, then I wouldn't recommend this bar."
,"The service was good but they forgot several items off of the burgers we ordered. My guest and I left feeling quite unsatisfied. We sat at the bar and ordered one well done burger and one medium burger and FB fries. 3 stars on my ordered toppings. Carmelized onions were burnt, didn't ask how I wanted my egg cooked so instead of over medium which is what I assumed they would make, I got one that was well, well done. Feta cheese was sliding off into a drippy mess. I don't mind messy burgers but messy burgers gotta be good. This one didn't make the cut. 3 stars on FB fries. Just okay which is sad because they should be better based on the mixture of ingredients.

What a really great burger needs more than an amazing bun and fresh toppings? A great burger! The meat. The patty. Its gotta be flavorful, juicy, seasoned correctly. This burger was dry. Even the medium burger was dry. My toppings couldn't even enhance the taste. If I had to guess I'd say the lack of seasoning was the issue. I've had really great burgers from specialty burger joints. This place has all the makings to be a great specialty burger place except an actual great burger. 

I did order the chicken pot pie fritters on the snack menu and those were tasty. You get 3 for the for $4. If I ever returned, I'd only order that.","It was an unfortunately unpleasant experience. While we had dined at Flip Burger establishments in the past and enjoyed ourselves, tonight's excursion was lackluster.
We arrived as walk in guests after catching a movie at the Plaza and were promptly seated. There was confusion over who was responsible for our table and though we placed our orders with one server, two others approached us over time to see whether or not we had ordered. We ordered one shake and three burgers, with modifications only to one (no condiments please). The burgers took an exceptionally long time (30 minutes). When the burgers arrived, the de-condimented burger was loaded with condiments, and the second burger didn't have any of the advertised condiments.
And the shake only arrived after re-requesting it when the burger arrived.

The food tasted fine. My chorizo burger was great, but the complications to the burgers was frustrating.

As a server myself, I often find myself bending over backwards to keep my customers happy. Tonight we were disappointed by our service and food and got little else than a shoulder shrug from our servers. There are tons of other burger places In the city - I'll be sure to try them out before returning to Flip.","Really rather disappointing, got a burger and fries for takeaway, almost 16 dollars.

burger was meh, fries average. i've tired the burger at the main spot as well, to me very overrated. if i want an overpriced burger i'd go to shake shack, if i wanted a truly great burger i'd make my own, weird every place in town wants to rip off this style."
