Mots,top_review_1,top_review_2,top_review_3
,"I love Greek food and have eaten at many Greek restaurants in Atlanta and New York.  Since I live less than 1.5 miles from this relatively new restaurant, I decided to finally give it a try.  The initial reviews on various sites for this restaurant were not great when they first opened a couple of months ago, but I felt it was time to have ironed out any issues with the food.  Unfortunately, the food was not worth a return trip.  

Although the staff was very friendly and provided good service, it could not make up for the overall experience.  As a small side complaint , the decor of the restaurant was a bit over the top on the tacky side with lots of neon and seemed very cold with too much echo because the walls are covered in various marble tiles and cut glass mirrors.  It reminds me of some of the over-the-top diners in Long Island.  The decor and lighting was a bit distracting during the meal, and the lighting was definitely too bright for an evening dinner.  This is not the place for an intimate or romantic dinner.  It would be great for a large group, I suppose, especially if you are into watching TV from almost every angle while you eat.

Starting out with appetizers for 2, we spent $19...ordered a spanakopita (7.95) and their combination plate of dips (10.95).  The spanakopita, which has always been a favorite of mine, was not good at all and was far too greasy with not enough dough for the copious amount of spinach.  The flavor was very bland and tasted like they skimped on ingredients or either it was just a pre-made frozen dish.  I have had better spanakopita from the grocery store freezer if that tells you how disappointing this dish was...especially since most Greek restaurants do a good job with this popular dish.  

The combination of dips was mediocre, but I did really like the spicy feta cheese dip.  Out of the ice-cream-scoop-sized selections, it was the only one that I can say was really tasty.  Their Taramousalata was just as bland as what you would find at the grocery store in a jar and did not taste at all like it was made on the premises.  Furthermore, I would consider their pita bread to be slightly below average in taste and texture for a Greek restaurant.  It was not any better than what you would find at the local grocery store full of preservatives. 

For dinner, we chose wraps (7.95-8.95).  The problem with both wraps was they were OVERLOADED to the point of frustration with lettuce and TONS of onion.  I love onion, but I had to take apart the wrap to remove a giant handful... and more and more shredded onion kept coming out!  it was just too much!  There was also WAY too much lettuce.  This restaurant does what many others do...which is load up the wraps and sandwiches with the cheaper stuff like lettuce, sauce and onion and skimp on the tomato, feta, olives, meat, etc.  We removed half of the lettuce and half of the onion which brought the wrap down to a normal and manageable size to eat.  However, that left us with very little else in the wrap since the meat, feta, etc was in such small quantity.  This is definitely a case where bigger was not better.  My sister said the flavor of her gyro meat was good, though.  

Perhaps my biggest surprise was how terrible the fries and Greek potatoes were.  The fries had a burned oil flavor...they were extremely hard, overcooked, and may well be the worst french fries I have ever eaten aside from when I accidentally burn the frozen kind in the oven at home.  The Greek potatoes were definitely better than the fries, but tasted like they had been sitting around for a while.  The texture of oven roasted potatoes should be soft but not mushy, sticky and wet.  The lemony flavor was pretty good, but they just didn't taste fresh at all...the taste was more akin to ""microwaved leftovers"" since they were overcooked and reheated.

The sweet tea was good and I drank lots of it.  And we would have gotten dessert since we love Greek pastries, but felt it would be a disappointment after everything else failed to meet our basic expectations.  Perhaps their other dishes are wonderful, but it is hard for me to trust a kitchen that doesn't bother to put any pride in the french fries or roasted potatoes they serve since they accompany almost every dish.  I felt the kitchen skimped on ingredients and did not produce dishes that made full use of all the wonderful seasonings you find with most Greek and Mediterranean restaurants.  In my opinion, this is more like the ""Waffle House"" of Greek restaurants...bright, loud and cheesy atmosphere with food that you shouldn't expect to be chef quality.","Recently moved from Vancouver to New WEst and we're on the hunt for a good pho spot. Came here on a sat for dinner and place was occupied by 2 other tables. Ordered #14 house special  pho, cold cut sandwich and spring rolls. We ordered the sandwich udner reccommendation from others. 
Sandwich: served on ciabatta likely from costco, large pieces of cucumber, pickled veggies, pate and some slices of pork roll. Disappointed they didn't put any cilantro. Overall the sandwich was nothing great, something anyone could easily put together at home. I will stick with ordering banh mi from actual banh mi shops to avoid disappointment. 

PHo: Extremely disappointed. Soup was not hot enough. I was repulsed by the first taste of the soup, something which has never happened before. I grew up eating fish sauce because my mom was raised in Haiphong, Vietnam but this place uses too much fish sauce. The soup lacked depth and complexity in traditional pho  soup flavours. I felt like they didn't use a long cooking method or spices. I could barely taste any star anise or cinnamon -- just fish sauce!! Hubby and I had to use a lot of hot sauce to make it more palatable.  Some slices of meat didn't taste as fresh, particularly the tendon which had a strange very stale taste - likely been sitting in the fridge and exposed to circulating air for a long time. 

Spring rolls: Wrapped in egg roll wraps. Filling was mostly vermicelli wit minimal amounts of meat or vegetables. I noticed that many of the pho houses here in New West use a lot more vermicelli compared to pho houses in Vancouver where a lot more meat and vegetables are used. OIl was not fresh so rolls came out very dark in colour but at least they were still crispy. 

Overall, not impressed with food and don't plan on coming back or recommend to anyone.","Well, I read these great reviews on Yelp for this place and said, we've got to try this. 

My husband and I experienced nothing interesting or even especially good, though very expensive for lunch. We both had lunch items from the lunch vermicelli platters, I had grilled shrimp and he had steak. We agreed the actual shrimp and beef pieces were excellent, but everything with them was bland to the point of tasteless. 

The side sauces of a syrupy sweet sauce and red peppery sauce, I suppose, were supposed to help, but though nothing was what I would call ""bad,"" nothing was good or flavorful. And the menu said an egg roll was included, which turned out to be so small that at first I missed it - cut into two barely bite sized pieces buried inside the salad. Basically the main dish was a big bow of greens and plain, un-sauced noodles, for $12.50 each!  I could've like it with,say, an oyster sauce.  SOMETHING.

Also, we originally ordered glasses of Pinot Grigio, which were obviously oxidized upon smelling and tasting. The server willingly replaced these with Chardonnays, but a server who can't tell that an orange glass of white wine is obviously not good, not to mention the smell, well, that is unprofessional at an inexcusable level. 

We live in Titusville and can find far better options for $12+ a piece for lunch. Nah, I don't see what these good reviews are based on. Saw nothing worth returning for."
,I went to kfc and first off when i got to the window the girl dropped my money before giving it to me so instead of coming around and getting it or even taken some out the drawer she just looked at me and said oh sorry.. i had to get out of my car to get it. And it's was raining as well.. and once i got home i opened mg box and they forgot my cookie.. great! And the food just looks sad.,"They get 4 stars for the food being good, however they have yet to get an order correct, so they get 2. Will not be returning. Such a shame.","Food is getting really bad and the server...sucks, took 45 minutes just to get us the bill."
,Worst service. 25 minutes until someone came to get our drink order... And that's after we had to ask the host where our server was. 30 min later Half the food came out. Then we waited another 10 minutes for the other half. Waited another 30 minutes for dessert. Good thing we ordered it the same time as our meal. We were there for 2 hours and 15 minutes. And there were NO apologies from any of the staff for the ridiculous wait. At least most of the food was good.,"The food was decent, not worth the 20 minute wait, and then another HOUR wait for food.
Overrated, and a waste of time.","As a neighborhood resident who likes to support local restaurants and businesses, I was appalled at the customer service we, and numerous other patrons, received at Lucca last Friday afternoon.  We arrived at 2 p.m. and the male server was very curt and rude to us, saying that it would be at least a 10 minute wait as he rushed past us.  The restaurant was about 20% full when we arrived so a 10 minute wait seemed absurd.  During what turned out to be a 25 minute wait, not one server apologized for the wait, explained the reason for the wait during what was clearly a slow time, or even smiled/acknowledged us.  Also seated in the waiting area, an older gentleman who referred to himself as Bob told us he'd been waiting for almost 30 minutes for a take-out order of soup.  While we waited 25 minutes to be seated, the following occurred: a pregnant woman and her mom who had been waiting to be seated before we even arrived were finally seated and they said it took them 30 minutes to be seated, a table of three women told their female server that they had been waiting 15 minutes for a take-out box for their leftovers and for their check to which the server replied ""I'm sorry but you'll just have to continue to wait,"" a woman with her toddler and mother took their check to the bar to pay saying they'd been waiting for 20 minutes to pay their check, and Bob, the neighborhood resident waiting for soup asked the male server ""how much longer for my simple bowl of soup?  I've been waiting for a half an hour.""  To that, the male server loudly snapped, ""Man, I don't know! It'll be up when it's up!""  We were truly horrified as were the other patrons in the restaurant who all heard that conversation.  Then, about five minutes later, the female server brought him two to-go containers of soup and a bag with a roll in it, plopped them all down separately on the bench where Bob was waiting and said ""that'll be $10!!""  She was so rude to him and she didn't bring his to-go order in a bag - she brought it in three separate containers.  Bob had to ask for a carry-out bag.  Bob then told me that he's lived in this neighborhood for almost 40 years and he's seen this location change from one entity to the next and he has always tried to support the neighborhood, but with this type of customer service, he's not sure he can return to Lucca.  I then overheard the female server snap at another customer saying ""We're understaffed today.  You'll just have to wait!""  Being understaffed certainly presents a challenge but it's never an excuse to treat customers terribly.  In the past, my girlfriends and I have regularly chosen Lucca as the venue for our monthly GNO's (girls' night out) but after last week's experience, I will strongly reconsider ever suggesting we host GNO at Lucca again.  If the customer service doesn't match and/or exceed the quality of the food, Lucca is not a restaurant I'd like to support any further.  And, we didn't...we left and drove to Cha Cha Cha on Fremont where we received tremendous customer service, delicious food and yummy cocktails.  And as a result, we promptly posted photos and details of our lovely experience on Facebook, Twitter and Yelp."
,We've ordered twice in about a month. Both times they got our orders wrong. Yesterday's order was not only wrong but it took 1 hr 5 min and we're less than 5 min away. Not ordering from there again.,Everytime I order it takes about an hr and I order the same thing weekly subs are always soggy enough said will Not order again!,"Ordered delivery and the food came 30 minutes later than the time they said. It was cold and the order was also wrong. When I called them to complain, they basically told me I ordered it wrong. Wtf. The food is disgusting and I will never order there again.  What a disappointment and a waste of $20"
,bad service dont go here! They needs to learn customer service... They're food is okay but the service is extremely bad..... Im not going here again.... My mom was even disappointed because of their service...,"Worst service ever!!!!!!!!!! Just pray you don't sit with Bri, worst attitude I ever encountered from a server","I just went there tonight to have a nice dinner with my girlfriend and the whole dinner ended bad with the worst customer service ever from the manager. He had bad manners, lied to us about how the restaurant.com certificate works and everything else. The food used to be good but seems to be getting worse day by day. The only good thing there is the creme of mushrooms and that's it. The service is bad, waiters give you attitude and manager is the worse. Sorry Chef Vincent, lost a long time customer by bad customer service and getting worse food."
,"Ok we tried Mod pizza tonight for 1st time. We are disappointed. 11 inches for a pizza is small barely enough to feed 2 people and definitely not enough to feed a family. Breadsticks are as flat as cardboard. I mean we know pizza being from Chicago we know good pizza. Toppings were sparce. These pizzas were flatter then thin crust. I don't think we will be eating here again. 11 inch pizza is basically a serving for one person. I mean Papa Murphy's, and Via Chicago even Flying pie has bigger pizzas then Mod Pizza. Even pizza hut or dominos pizzas are bigger then Mod pizza.",Worst Dominos pizza experience I have ever had!!!!!!  I ordered my pizza at 11:19. At 1151 my pizza was out for delivery. I waited a whole hour for my pizza and once it arrived it was cold and I had to reheat my pizza!!!! I would not recommend this place to anyone!! I am encouraging everyone to find a different dominos! This one SUCKS!,"This place sucks from the food preparation,  to the oven they use. Pizza is just awful. You get better taste eating the pizza box.The Arby's of pizza."
,Foods alright but not for the price...the price was food poisoning! I've had to worst food poisoning for 3 days now!,"FOOD IS GOOD SERVICE IS POOR. Walked in and ordered food. 35 min later (and 12minutes past closing time) still no food. I ask about the food and employee asked what was ordered -_-  she then leaves returns with the food. No apology, no remorse, just hands the food over.",The place is really charming in the German Village. The food was so so.  Nothing on the menu was authentic German food.  I'm German and nothing would fly as German food back in Germany.  The taste and food quality was subpar.
,"Sorry to be a downer and go against the grain here but my experience at Santarpios in the space of a year has been less than thrilling. The first time I went the pizza was great, I loved it and raved about it to friends. We also got the sauasages and meat they bbq which was good. The second time I went it was ok, not as good as the first time. I thought maybe it's an off night. The third time I went with some friends who I had told it was really great. Well turns out it was awful!!! I don't know what happened. I was embarassed in front of my friends. I never went back. Santarpio's you're dead to me!!! Dead I tell you!  Pepe's all the way!!!","We have been to Roscoe's several times over the last year...It seems every time we go, they get worse!  
The beers are mostly IPA's or aged something or another...SOUR SUMMIT was this weekend and it sucked!  The prices get higher every time we go, too!???!
I have had the oyster Po'Boy many times and this time it left a huge GUT-BOMB in my belly!!  The bun was dry as all get out AND the sandwich barely had any slaw OR oysters!!!  It was a huge disappointment and I doubt we will be back!!!",Second time I got food poisoning from this place. It tasted great going down but the 4 times vomited last night was a horrible suprise I'm done.
,"This place used to be a cool, chill place. Now its a bunch of neanderthal bouncers hopped up on steroids acting like the can do whatever they want. There are so many better places in davis square where they are glad you are visiting their business. Sad that the burren is now the worst place in davis.","There's some really strange decor inside, like, murals and multipiece mirrors, sports decorations for Patriots, Celtics, Bruins, Red Sox and Revolution all in the same place, and a really out of place sign that reads ""Home of Generation X"" or something like that. What the hell? Feels like this place is still stuck in 1995.

I've only bought some chicken vegetable soup on one occasion and the falafel+hummus wrap on another. Both were mediocre for taste and quality. I guess you'll want to stick to their deserts, which is what people seem to like about this place.","I don't know what happened to this place, I think its going in decline. For starters the staff isn't really customer service oriented. Restrooms look detrimentally in need of attention. To be fair the food is edible (had the asadero enchiladas) but the rice (and my friend agreed) tasted horrible like plastic. Her chicken breast also tasted like it had been frozen. I don't mean to bash the place, but Im just disappointed that this place is supposed to be a genuine Mexican place and I feel bad that I've actually been referring people here when they ask of good Mexican food places to try, that changed today."
,"We went there for Taco Tuesday tonight . Not worth it at all 3 tacos for $3  maybe... but even at that they have no flavor not good your better off going to many others places for that price .  We asked.the waitress  what she recommended for Taco Tuesday or anything on the menu there she said she just started working and didn't know,  she did not explain the taco prices that they were all different just that we could Not order one of each. So they charged us $18 for 6 tacos on Taco Tuesday wtf . Tacos everywhere are only $1-$2  especially for average tacos on Taco Tuesday.  We only went in to try because we saw there sign advertise that they have homemade tacos , after eating there that is hard to believe. We talked  to another employee and our waitress  they pretty much defended themselves and ignored what we had to say  and charged us $18 for 6 not good tacos when we clearly told are waitress it was our first time there for Taco Tuesday and was there for the 3 for $3 and asked for recommendations she was so unhelpful and charged us for what she did not explain prices it's not like it was on the regular menu . NOT IMPRESSED.","I initially came here thinking it was a different Mexican place (meant to go to El Pelon Taqueria) and wanted fish tacos. The quality and freshness of the ingredients seemed to be pretty good but they gave me vegetable tacos when i ordered fish tacos. After I paid and complained, I don't think they understood me and just told me they did not have fish tacos. Would have been nice to know before they served me.

Bang for your buck, at $3 a taco I would have probably walked over to Chipotle or went a little farther to El Pelon Taqueria which has much better food IMHO.","2 people dinning his fish sandwich came to the table. I waited for my 2 tacos, 1 fish 1 jimichurri.  And waited. After he was 1/2 done my 2 tacos finally came. Fish taco was soggy and the stk taco dripped oil.  Not good won't be back."
,"This chicken is not all that. It's just lightly fried chicken. The sides are bland as well. Go to Lucy's fried chicken instead, that chicken and sides are the bomb!","Had the Southern Fried Chicken Salad. Wasnt very good. Menu says it has a chicken breast on it..
Ended up with just chopped chicken fingers. Very disappointing and menu is not accurate.",The chicken biryani was OK but the chicken tikka masala was horrible i won't come back again
